{
  "schemaVersion": "1.0",
  "changeId": "delegated-billing",
  "title": "Delegated billing ownership",
  "intent": "Let enterprise accounts delegate billing to another account while keeping ownership and eligibility responsibilities explicit.",
  "baseRef": "HEAD",
  "sourceDigest": "",
  "groups": [
    {
      "id": "ownership",
      "title": "Account ownership",
      "summary": "Account management exposes who owns the account and which account pays. Billing policy stays at the billing boundary.",
      "componentIds": [
        "accounts",
        "billing"
      ],
      "decisionIds": [
        "policy-owner"
      ],
      "paths": []
    },
    {
      "id": "migration",
      "title": "Client compatibility",
      "summary": "Existing clients keep their current ownership contract while delegated ownership is introduced explicitly.",
      "componentIds": [
        "clients",
        "accounts"
      ],
      "decisionIds": [
        "migration-contract"
      ],
      "paths": []
    }
  ],
  "components": [
    {
      "id": "clients",
      "name": "Client applications",
      "current": "Send the account owner as the payer.",
      "intended": "May provide a separate billing owner while keeping existing requests valid.",
      "observed": "Demo only: implementation has not been inspected."
    },
    {
      "id": "accounts",
      "name": "Account management",
      "current": "Own account identity and a single owner reference.",
      "intended": "Own account identity and delegation. Expose ownership facts to billing.",
      "observed": "Demo only: implementation has not been inspected."
    },
    {
      "id": "billing",
      "name": "Billing service",
      "current": "Evaluate eligibility for the account owner.",
      "intended": "Evaluate eligibility for the delegated billing owner.",
      "observed": "Demo only: implementation has not been inspected."
    }
  ],
  "relations": [
    {
      "id": "client-account",
      "from": "clients",
      "to": "accounts",
      "label": "Ownership contract",
      "state": "both"
    },
    {
      "id": "account-billing",
      "from": "accounts",
      "to": "billing",
      "label": "Delegated payer",
      "state": "intended"
    },
    {
      "id": "result",
      "from": "billing",
      "to": "accounts",
      "label": "Return the billing result",
      "state": "intended"
    },
    {
      "id": "response",
      "from": "accounts",
      "to": "clients",
      "label": "Return the response",
      "state": "both"
    },
    {
      "id": "rejected",
      "from": "billing",
      "to": "accounts",
      "label": "Reject the payer",
      "state": "intended"
    },
    {
      "id": "retry",
      "from": "accounts",
      "to": "accounts",
      "label": "Retry the request",
      "state": "intended"
    }
  ],
  "decisions": [
    {
      "id": "policy-owner",
      "title": "Who owns eligibility policy?",
      "choice": "Billing owns eligibility; account management supplies ownership facts.",
      "alternatives": [
        "Account management duplicates eligibility checks.",
        "A separate policy service owns eligibility."
      ],
      "consequences": [
        "Billing is the single policy owner.",
        "The delegation contract crosses service boundaries."
      ],
      "status": "proposed",
      "provenance": "agent",
      "evidenceIds": []
    },
    {
      "id": "migration-contract",
      "title": "How do existing clients migrate?",
      "choice": "Preserve the owner field and add an optional billing owner.",
      "alternatives": [
        "Require all clients to migrate to a new contract."
      ],
      "consequences": [
        "Old clients continue using the account owner for billing."
      ],
      "status": "proposed",
      "provenance": "agent",
      "evidenceIds": []
    }
  ],
  "evidence": [],
  "acceptanceCriteria": [
    "Delegation does not move billing policy into account management.",
    "Existing client requests remain valid."
  ],
  "nonGoals": [
    "Changing payment processing providers."
  ],
  "unknowns": [
    "This example describes hypothetical paths. It is not implementation evidence."
  ],
  "supportingChanges": [],
  "scenarios": [
    {
      "id": "success",
      "title": "Bill the delegated payer",
      "trigger": "The client submits an account.",
      "outcome": "The client receives a billing result.",
      "current": [
        {
          "id": "step-1",
          "relationId": "client-account"
        },
        {
          "id": "step-2",
          "relationId": "response"
        }
      ],
      "intended": [
        {
          "id": "step-1",
          "relationId": "client-account"
        },
        {
          "id": "step-2",
          "relationId": "account-billing"
        },
        {
          "id": "step-3",
          "relationId": "result"
        },
        {
          "id": "step-4",
          "relationId": "response"
        }
      ]
    },
    {
      "id": "failure",
      "title": "Reject an ineligible payer",
      "trigger": "The client submits an ineligible payer.",
      "outcome": "The client receives a rejection.",
      "current": [],
      "intended": [
        {
          "id": "step-1",
          "relationId": "client-account"
        },
        {
          "id": "step-2",
          "relationId": "account-billing"
        },
        {
          "id": "step-3",
          "relationId": "rejected"
        },
        {
          "id": "step-4",
          "relationId": "response"
        }
      ]
    },
    {
      "id": "retry-flow",
      "title": "Retry the billing request",
      "trigger": "An attempt cannot complete.",
      "outcome": "The client receives a result after the retry.",
      "current": [],
      "intended": [
        {
          "id": "step-1",
          "relationId": "client-account"
        },
        {
          "id": "step-2",
          "relationId": "retry"
        },
        {
          "id": "step-3",
          "relationId": "account-billing"
        },
        {
          "id": "step-4",
          "relationId": "result"
        },
        {
          "id": "step-5",
          "relationId": "response"
        }
      ]
    }
  ]
}
